X,Y,fid,corrltv,prd_fsc,ciclo,entidad,redi,estado,municip,parroqu,categor,subctgr,mnt_pry,nmbr_pr,dscrpc_,estts_p,huso_nc,hus_fnl,crd_st_,crd_nr_,tipo_br,fech_nc,cotizcn,mnt_pr_,cntdd__,undd_br,mtrls_c,mtrl_tp,mtrl_cn,clsfccn,motivo,clasi2,costo,atipics,Longitd,Latitud,icon_url
-71.5803080793284,8.67472644920117,"291",PI-2023-C-4-E-351-00038921,"2023",C4,GOBERNACIÓN DE MÉRIDA,Los Andes,Mérida,Alberto Adriani,Héctor Amable Mora,Vialidad,"Sistema Vial Nacional (troncal, local, ramal y sub-ramal)",5150796.82,rehabilitacion integral de 4800 metros cuadrados de asfaltado de la troncal 001 desde el sector cacique mucujepe hasta el sector caño jabon de la parroquia hector amable mora del municipio alberto adriani del estado bolivariano de merida,rehabilitacion integral de 4800 metros cuadrados de asfaltado de la troncal 001 desde el sector cacique mucujepe hasta el sector caño jabon de la parroquia hector amable mora del municipio alberto adriani del estado bolivariano de merida donde se van a r,Culminado,"19","19","215602","958944",Rehabilitación o Mejora,2023/03/10,24.12,213548.790215589,4800,m2,Si,asfalto,"970",carpeta,Elementos no asfalticos,,220.153391974834,no,-71.5803080793284,8.67472644920117,./0.png
-68.7421528710005,10.3411859144354,"292",PI-2023-C-4-E-360-00038989,"2023",C4,GOBERNACIÓN DE YARACUY,Occidental,Yaracuy,San Felipe,Capital San Felipe,Vialidad,"Sistema Vial Nacional (troncal, local, ramal y sub-ramal)",887412.36,"rehabilitacion a traves de bacheos puntuales  de la local 03, albarico-yumare del estado yaracuy.","ésta red vial es atendida mediante la ejecución de un plan de mantenimiento vial para la local 03 albarico-yumare, es por ello que éste proyecto busca adquirir la mezcla asfaltica para la reconstrucción de carpetas de rodamiento y la construcción de bach",Culminado,"19","19","528232","1143143",Rehabilitación o Mejora,2023/03/10,24.12,36791.5572139303,638,m2,Si,mezcla asfaltica,"900",bacheo,Elementos no asfalticos,,40.8795080154782,no,-68.7421528710005,10.3411859144354,./0.png
-71.6639686687738,10.5704996806573,"293",PI-2023-C-4-E-361-00039015,"2023",C4,GOBERNACIÓN DE ZULIA,Occidental,Zulia,San Francisco,Marcial Hernández,Vialidad,Sistemas de Vías de Acceso (calles y avenidas),1249128.53,"reasfaltado de la vía a perija en el tramo comprendido desde la  ferretería bicolor hasta licomarca , parroquia marcial hernandez, municipio san francisco, estado zulia.","se plantea el reasfaltado de 210,11 metros lineales  en tramos de vía deteriorados, a través de las actividades de limpieza a mano en calzada  y riego de adherencia con rc250 en un area de 5.555 m2, suministro, transporte y colocación de 598 toneladas de",Culminado,"19","19","208788","1170042",Rehabilitación o Mejora,2023/03/10,24.12,51788.0816749585,5555,m2,Si,toneladas de mezcla asfaltica en caliente tipo iii,"598",carpeta,Elementos no asfalticos,,86.6021432691614,no,-71.6639686687738,10.5704996806573,./0.png
-71.6572610983997,10.6755260685441,"294",PI-2023-C-4-E-361-00039018,"2023",C4,GOBERNACIÓN DE ZULIA,Occidental,Zulia,Maracaibo,Caracciolo Parra Pérez,Vialidad,Sistemas de Vías de Acceso (calles y avenidas),6360506.21,"reasfaltado de la avenida valmore rodriguez entre calles 65 (los pinos) y 78 (la limpia), parroquia caracciolo parra perez, municipio maracaibo, estado zulia.
","intervención de 1500 ml de via en condiciones de deterioro, mediante remoción de 7.071 m2 de pavimento de asfalto en tramos criticos, colocación de 2.854 ton con mezcla asfaltica en caliente tipo iii. con el fin de consolidar la estructura vial que se tr",Culminado,"19","19","210112","1182486",Rehabilitación o Mejora,2023/03/10,24.12,263702.579187396,7071,m2,Si,toneladas de asfalto en caliente tipo iii,"2854",carpeta,Elementos no asfalticos,,92.3975400095993,no,-71.6572610983997,10.6755260685441,./0.png
-71.6274962374047,10.6463859762802,"295",PI-2023-C-4-E-361-00039019,"2023",C4,GOBERNACIÓN DE ZULIA,Occidental,Zulia,Maracaibo,Cacique Mara,Vialidad,Sistemas de Vías de Acceso (calles y avenidas),4343140.34,"reasfaltado en tramos criticos del corredor vial la limpia comprendidos entre las intersecciones con la  av. 63 y la  av. 18, parroquia cacique mara, municipio maracaibo, estado zulia.","se plantea la rehabilitacion de tramos criticos en una longitud de 4,3 km, mediante colocación de 1873 ton de mezcla asfaltica en caliente tipo iii para la ejecución de bacheo, saneamiento de bombas, construcción de carpetas de nivelacion y rodamiento co",Culminado,"19","19","209667","1181045",Rehabilitación o Mejora,2023/03/10,24.12,180063.861525705,18094,m2,Si,toneladas de mezcla asfaltica en caliente tipo iii,"1873",bacheo,Elementos no asfalticos,,96.1366051925813,no,-71.6274962374047,10.6463859762802,./0.png
-67.079669882193,10.3297388448443,"296",PI-2023-C-5-E-118-00039061,"2023",C5,ALCALDÍA DE GUAICAIPURO (EDO. MIRANDA),Central,Miranda,Guaicaipuro,Los Teques,Vialidad,Sistemas de Vías de Acceso (calles y avenidas),2415000,"mejoramiento vial en el tramo que corresponde la calle roscio a nivel de villa teola, hasta la entrada de la urbanización asocsuveas, la cual incluye: escarificaciòn, s/t/c de mezcla asfaltica caliente, parroquia los teques, municipio guaicaipuro.","se proyecta los trabajos de la escarificaciòn de 4840,40m2 de la carpeta asfaltica, la cual se disgrega a lo largo del tramo vial comprendido entre la calle roscio a nivel de villa teola hasta la entrada de la urbanizaciòn asocsuveas, para el s/t/c de 57",Culminado,"19","19","714009","1143608",Rehabilitación o Mejora,2023/03/21,24.18,99875.9305210918,4840.4,m2,Si,mezcla asfaltica caliente,"570",carpeta,Elementos no asfalticos,,175.220930738758,no,-67.079669882193,10.3297388448443,./0.png
-67.3054633037722,10.2249205587763,"297",PI-2023-C-5-E-138-00039118,"2023",C5,ALCALDÍA DE JOSÉ FÉLIX RIBAS (EDO. ARAGUA),Central,Aragua,José Félix Ribas,Castor Nieves Ríos,Vialidad,Sistemas de Vías de Acceso (calles y avenidas),1756540,"repavimentación en asfalto tipo iii tramo de la avenida bicentenaria - zona industrial la mora ii , parroquia castor nieves ríos , la victoria , municipio josé félix ribas, estado aragua",colocacion   de 1000 toneladas de asfalto tipo iii.,Culminado,"19","19","685489","1130683",Rehabilitación o Mejora,2023/03/21,24.18,72644.3341604632,2970,m2,Si,toneladas de mezcla asfaltica,"1000",carpeta,Elementos no asfalticos,,72.6443341604632,no,-67.3054633037722,10.2249205587763,./0.png
-67.626417798909,10.2828721057899,"298",PI-2023-C-5-E-182-00039140,"2023",C5,ALCALDÍA DE MARIO BRICEÑO IRAGORRY (EDO. ARAGUA),Central,Aragua,Mario Briceño Iragorry,Caña De Azúcar,Vialidad,Sistemas de Vías de Acceso (calles y avenidas),1430000,"rehabilitación  de la av 5 de la parroquia caña de azúcar, desde el mercado periférico hasta la avenida 4 del municipio mario briceño iragorry, estado aragua","este proyecto contempla la rehabilitación  de la av 5 de caña de azúcar desde el mercado periférico hasta la avenida 4, se estima alcanzar la recuperación de tramos de carpeta asfaltica en dicha zona a fin de mejorar las condiciones de transito. este pro",Culminado,"19","19","650116","1137589",Rehabilitación o Mejora,2023/03/21,24.18,59139.7849462366,183,m2,Si,asfalto (toneladas),"1100",carpeta,Elementos no asfalticos,,53.7634408602151,no,-67.626417798909,10.2828721057899,./0.png
-68.2736083790302,10.2205506747933,"299",PI-2023-C-5-E-195-00039100,"2023",C5,ALCALDÍA DE MONTALBÁN (EDO. CARABOBO),Central,Carabobo,Montalbán,Urbana Montalbán,Vialidad,"Sistema Vial Nacional (troncal, local, ramal y sub-ramal)",924000,i etapa de la rehabilitacion de la infraestructura vial en la carretera principal aguirre-centro desde la plaza  la ceiba hasta el callejon de la iglesia sagrado corazon de jesus del sector aguirre del municipio montalban estado carabobo.,"se refiere a colocacion de asfalto tipo bacheo con equipo liviano y pesado en algunos tramos, incluido el riego de adherencia rc 250 y compactacion.",Culminado,"19","19","579496","1129703",Rehabilitación o Mejora,2023/03/21,24.18,38213.3995037221,1687,m2,Si,mezcla asfaltica tipo iii,"200",bacheo,Elementos no asfalticos,,191.06699751861,no,-68.2736083790302,10.2205506747933,./0.png
-69.1029438343183,10.0632190859276,"300",PI-2023-C-5-E-229-00039129,"2023",C5,ALCALDÍA DE PEÑA (EDO. YARACUY),Occidental,Yaracuy,Peña,Capital Peña,Vialidad,Sistemas de Vías de Acceso (calles y avenidas),1138379.59,"bacheo en la avenida 3 del sector sabanita, municipio peña, yaritagua estado yaracuy.",realizar la rehabilitación de pavimento flexible de la avenida 3 desde la manga de coleo hasta la avenida francisco de miranda del sector sabanita removiendo la carpeta asfaltica con maquinaria pesada colocando 265 toneladas de mezcla asfaltica iv.,Culminado,"19","19","488832","1112907",Rehabilitación o Mejora,2023/03/21,24.18,47079.3875103391,1620,m2,Si,mezcla asfaltica en caliente tipo iv (toneladas),"265",bacheo,Elementos no asfalticos,,177.658066076751,no,-69.1029438343183,10.0632190859276,./0.png
-67.6104118541574,8.10647766289883,"301",PI-2023-C-5-E-329-00039037,"2023",C5,ALCALDÍA DEL MUNICIPIO CAMAGUÁN (EDO. GUÁRICO),Los LLanos,Guárico,Camaguán,Camaguán,Vialidad,Sistemas de Vías de Acceso (calles y avenidas),1226007.93,"suministro, transporte y colocacion de mezcla  asfaltica en caliente, en  la  avenida  guaicaipuro (paez), de la parroquia camaguan, municipio camaguan del estado guarico.","se haran trabajos que consisten en la limpieza de la zona a rehabilitar, retiro de material excedente, aplicacion de riego de adherencia de la superficie empleando material asfaltico tipo rc - 250, posteriormente se procedera a la colocacion de asfalto c",Culminado,"19","19","653660","896391",Rehabilitación o Mejora,2023/03/21,24.18,50703.388337469,2521,m2,Si,mezcla asfaltica en caliente (toneladas),"273",carpeta,Elementos no asfalticos,,185.726697206846,no,-67.6104118541574,8.10647766289883,./0.png
-71.2281830971662,8.57361527990142,"302",PI-2023-C-5-E-63-00039099,"2023",C5,ALCALDÍA DE CAMPO ELÍAS (EDO. MÉRIDA),Los Andes,Mérida,Campo Elías,Montalbán,Vialidad,"Sistema Vial Nacional (troncal, local, ramal y sub-ramal)",848200,mejoramiento y reparación (bacheo) de la vía principal del salado desde el puente de la urb alfredo lara hasta la escuela basica el salado. parroquia montalban. municipio campo elías del estado bolivariano de mérida.,el proyecto consiste en la reparación y mejoramiento de la vialidad a través del bacheo menor (hasta 30 m2) de la vía principal del salado con la colocación de 100 toneladas de asfalto para mejorar la transitabilidad y seguridad de los peatones y vehícul,Culminado,"19","19","254137","946742",Rehabilitación o Mejora,2023/03/21,24.18,35078.5773366419,13000,m2,Si,asfalto (toneladas),"100",bacheo,Elementos no asfalticos,,350.785773366418,si,-71.2281830971662,8.57361527990142,./0.png
-67.6146570506972,5.66828041556196,"303",PI-2023-C-6-E-339-00039192,"2023",C6,GOBERNACIÓN DE AMAZONAS,Sur,Amazonas,Autónomo Atures,Fernando Girón Tovar,Vialidad,Sistemas de Vías de Acceso (calles y avenidas),4054018.75,"mejora de carpeta asfaltica, demarcación y señalización de vialidad de la avenida 23 enero  de  la ciudad de puerto ayacucho,  municipio atures del estado amazonas
","compre colocación de asfalto de  la avenida 23 de enero desde la esquina caliente hasta la plaza la resistencia , lo cual comprende colocación de capa asfaltica, demarcación y señalización de vialidad,  para la continuación del asfaltado de la ciudad de",Culminado,"19","19","651927","626159",Rehabilitación o Mejora,2023/04/21,24.59,164864.528263522,10000,m2,Si,"	material asfaltico a-30 (ton)","15",bacheo,Elementos no asfalticos,,10990.9685509015,si,-67.6146570506972,5.66828041556196,./0.png
-68.1513338469743,9.28264301562001,"304",PI-2023-C-6-E-346-00039212,"2023",C6,GOBERNACIÓN DE COJEDES,Los LLanos,Cojedes,Pao De San Juan Bautista,El Pao,Vialidad,"Sistema Vial Nacional (troncal, local, ramal y sub-ramal)",1785000,"rehabilitacón de la troncal 008, tramo la aduana - la cebadilla, en el municipio pao de san juan bautista del estado bolivariano de cojedes, a través de la secretaría de infraestructura y servicios públicos adscrita a la gobernación del estado.

","consiste en la remoción de asfalto con equipo liviano y pesado,carga y bote de material,transporte y colocacion 450 toneladas de mezcla asfaltica en caliente,en el tramo que comprende la aduana - la cebadilla en el pao,del municipio pao de san juan bauti",Culminado,"19","19","593032","1006347",Rehabilitación o Mejora,2023/04/21,24.59,72590.4839365596,2760,m2,Si,toneladas de mezcla asfaltica,"450",carpeta,Elementos no asfalticos,,161.312186525688,no,-68.1513338469743,9.28264301562001,./0.png
-71.5752567931955,8.74869685578388,"305",PI-2023-C-6-E-351-00039183,"2023",C6,GOBERNACIÓN DE MÉRIDA,Los Andes,Mérida,Obispo Ramos De Lora,Eloy Paredes,Vialidad,"Sistema Vial Nacional (troncal, local, ramal y sub-ramal)",2188000,rehabilitacion integral de 2500 metros cuadrados de asfaltado de la troncal 001 desde el sector la montañita  hasta el sector guayabones de la parroquia eloy paredes del municipio obispo ramos de lora del estado bolivariano de merida,rehabilitacion integral de 2500 metros cuadrados de asfaltado de la troncal 001 desde el sector la montañita  hasta el sector guayabones de la parroquia eloy paredes del municipio obispo ramos de lora del estado bolivariano de merida donde se van a reali,Culminado,"19","19","216657","968059",Rehabilitación o Mejora,2023/04/21,24.59,88979.2598617324,2500,m2,Si,asfalto,"450",carpeta,Elementos no asfalticos,,197.731688581628,no,-71.5752567931955,8.74869685578388,./0.png
-69.5719406822949,8.74314564338737,"306",PI-2023-C-6-E-355-00039179,"2023",C6,GOBERNACIÓN DE PORTUGUESA,Los LLanos,Portuguesa,Guanare,Capital Guanare,Vialidad,"Sistema Vial Nacional (troncal, local, ramal y sub-ramal)",6578179.91,"rehabilitación de vialidad ramal 56-54 guanare - gato negro - morita, municipio guanare. estado portuguesa","consiste en la recuperación de la vía, realizando bacheo que consta en la señalización de manejo de trafico, corte, demolición y retiro de pavimiento existente, imprimación e instalación de mezcla de asfalto, compactación con vibro compactador y compacta",Culminado,"19","19","420142","995941",Rehabilitación o Mejora,2023/04/21,24.59,267514.433102887,35398,m2,Si,mezcla asfaltica en toneladas,"4047",bacheo,Elementos no asfalticos,,66.1019108235452,no,-69.5719406822949,8.74314564338737,./0.png
-71.6750006643409,10.5600793076183,"307",PI-2023-C-6-E-361-00039377,"2023",C6,GOBERNACIÓN DE ZULIA,Occidental,Zulia,San Francisco,Domitila Flores,Vialidad,Sistemas de Vías de Acceso (calles y avenidas),2457000,"reasfaltado de la via a perija en el tramo comprendido desde licomarca hasta la interseccion con la calle 177 , parroquia domitila flores, municipio san francisco, estado zulia.","se plantea el reasfaltado de 1004,89 metros lineales  en tramos de via deteriorados, a traves de las actividades de limpieza a mano en calzada  y riego de adherencia con rc250 en un area de 11.042 m2, suministro, transporte y colocacion de 1.217 tonelada",Culminado,"19","19","208466","1169734",Rehabilitación o Mejora,2023/04/28,24.69,99513.9732685298,11042,m2,Si,toneladas de asfalto en caliente tipo iii,"1217",carpeta,Elementos no asfalticos,,81.7699040826046,no,-71.6750006643409,10.5600793076183,./0.png
-71.615555125129,10.7186151625063,"308",PI-2023-C-6-E-361-00039379,"2023",C6,GOBERNACIÓN DE ZULIA,Occidental,Zulia,Maracaibo,Coquivacoa,Vialidad,Sistemas de Vías de Acceso (calles y avenidas),2457000,"reasfaltado de la prolongación  av. milagro norte, tramo comprendido entre calle 14 (entrada a bahias del lago)  hasta av 11a-1 (frente al c.c. ciudad 2000), parroquia coquivacoa, municipio maracaibo, estado zulia.","reasfalto de 350 ml, actualmente la capa de rodamiento se encuentra en malas condiciones de transitabilidad, planteandose la ejecución de las siguientes actividades: limpieza en calzada y riego de adherencia  en un area de 7.777 m2, suministro, transport",Culminado,"19","19","213575","1186484",Rehabilitación o Mejora,2023/04/28,24.69,99513.9732685298,7777,m2,Si,toneladas de asfalto en caliente tipo iii,"718",carpeta,Elementos no asfalticos,,138.598848563412,no,-71.615555125129,10.7186151625063,./0.png
-71.6173104586554,10.6398212060043,"309",PI-2023-C-6-E-361-00039380,"2023",C6,GOBERNACIÓN DE ZULIA,Occidental,Zulia,Maracaibo,Chiquinquirá,Vialidad,Sistemas de Vías de Acceso (calles y avenidas),1228500,"reasfaltado de la calle 100 (capa base), entre av. 17 y av. 13a (sentido oeste- este), sector casco central, parroquia chiquinquira, municipio maracaibo estado zulia.","se plantea el reasfaltado de 0,54 km de vialidad, mediante el suministro, transporte y colocacion de 602 ton de mezcla asfaltica en caliente tipo iii, en un area de  5.416 m2 para la construccion de capa de nivelación (base).",Culminado,"19","19","213103","1177273",Rehabilitación o Mejora,2023/04/28,24.69,49756.9866342649,5.416,m2,Si,toneladas de asfalto en caliente tipo iii,"602",carpeta,Elementos no asfalticos,,82.652801718048,no,-71.6173104586554,10.6398212060043,./0.png
-71.6254119090353,10.7015006844524,"310",PI-2023-C-6-E-361-00039382,"2023",C6,GOBERNACIÓN DE ZULIA,Occidental,Zulia,Maracaibo,Juana De Avila,Vialidad,Sistemas de Vías de Acceso (calles y avenidas),1670760,"reasfaltado de la  av. paul moreno tramo entre la calle 32 sector san jacinto y la calle 41 sector viento norte, sentido av. milagro norte hacia prolongación c-2. parroquia juana de avila, municipio maracaibo, estado zulia.
","se plantea el reasfaltado de 0,91 km de vialidad, mediante el suministro, transporte y colocación de 789 ton de mezcla asfaltica en caliente tipo iii. en un area de 6.861 m2",Culminado,"19","19","213048","1185382",Rehabilitación o Mejora,2023/04/28,24.69,67669.5018226002,6861,m2,Si,toneladas de asfalto en caliente tipo iii,"789",carpeta,Elementos no asfalticos,,85.7661620058305,no,-71.6254119090353,10.7015006844524,./0.png
-69.033819225099,10.1258757275164,"311",PI-2023-C-7-E-136-00039159,"2023",C7,ALCALDÍA DE JOSÉ ANTONIO PÁEZ (EDO. YARACUY),Occidental,Yaracuy,José Antonio Páez,Capital José Antonio Páez,Vialidad,Sistemas de Vías de Acceso (calles y avenidas),880320,"adquisición de mezcla asfaltica para el bacheo de diferentes tramos de la carrera 4, desde la calle 2 hasta la avenida libertador, sector cuatro esquina, municipio jose antonio paez, estado yaracuy.",se plantea el bacheo en varios tramos con material asfaltico donde se ha realizado reparaciones del colector principal de cloacas y empotramientos de acueductos.,Culminado,"19","19","495488","1118048",Rehabilitación o Mejora,2023/04/21,24.59,35799.9186661244,800,m2,Si,mezcla asfaltica  (ton),"200",bacheo,Elementos no asfalticos,,178.999593330622,no,-69.033819225099,10.1258757275164,./0.png
-71.1925012737146,8.58749553061285,"312",PI-2023-C-7-E-164-00039309,"2023",C7,ALCALDÍA DE LIBERTADOR (EDO. MÉRIDA),Los Andes,Mérida,Libertador,Lasso De La Vega,Vialidad,Sistemas de Vías de Acceso (calles y avenidas),2447000,bacheo y asfaltado desde el puente la pedregosa hasta la gran parada de la urb. la pedregosa parroquia lasso de la vega del municipio libertador del estado bolivariano de mérida-fci 2023,"el proyecto contempla la demolición de pavimento flexible con equipo liviano y transporte para bote, transporte para carga de suministro de mezcla asfaltica, imprimación asfaltica tipo rc-250 y la colocación de 292 toneladas de asfalto para ejecutar el b",Culminado,"19","19","258740","948123",Rehabilitación o Mejora,2023/04/21,24.59,99511.996746645,1898,m2,Si,mezcla asfaltica tipo iv (toneladas),"292",bacheo/carpeta,Elementos no asfalticos,,340.794509406318,no,-71.1925012737146,8.58749553061285,./0.png
-68.022657480703,10.2926835181592,"313",PI-2023-C-7-E-201-00039167,"2023",C7,ALCALDÍA DE NAGUANAGUA (EDO. CARABOBO),Central,Carabobo,Naguanagua,Urbana Naguanagua,Vialidad,Sistemas de Vías de Acceso (calles y avenidas),2447000,"recuperacion integral de la avenida valmore rodriguez en la  zona norte del municipio naguanagua, estado carabobo.","la obra abordara la avenida valmore rodríguez desde la principal de la vivienda hasta la ruta de este, y se ejecutara  las siguientes actividades: demolición de pavimento de asfalto y de concreto, así como de acera y brocales, excavación para la preparac",Culminado,"19","19","607399","1136865",Rehabilitación o Mejora,2023/04/21,24.59,99511.996746645,4200,m2,Si,mezcla asfaltica,"100",heterogeneo_asf,Elementos no asfalticos,,,no,-68.022657480703,10.2926835181592,./0.png
-71.0308551720618,8.66657572306638,"314",PI-2023-C-7-E-275-00039282,"2023",C7,ALCALDÍA DE SANTOS MARQUINA (EDO. MÉRIDA),Los Andes,Mérida,Santos Marquina,Tabay,Vialidad,"Sistema Vial Nacional (troncal, local, ramal y sub-ramal)",1533210,"mejoramiento integral de la via principal de la parroquia tabay desde el sector las calaveras hasta el sector el pedregal, municipio santos marquina del estado bolivariano de merida (2023)
","se realizaran trabajos de reparación, remoción y acondicionamiento en los baches que presenta la vía utilizando mezcla  asfaltica en caliente,  posteriormente se realizara la señalizacion-demarcación con pintura trafico y colocacion señalizadores bidirec",Culminado,"19","19","267710","953055",Rehabilitación o Mejora,2023/04/21,24.59,62350.9556730378,1100,m2,Si,ton de asfalto,"150",carpeta,Elementos no asfalticos,,415.673037820252,si,-71.0308551720618,8.66657572306638,./0.png
-67.0140187872175,9.99829298973006,"315",PI-2023-C-7-E-252-00039247,"2023",C7,ALCALDÍA DE SAN CASIMIRO (EDO. ARAGUA),Central,Aragua,San Casimiro,San Casimiro,Vialidad,Sistemas de Vías de Acceso (calles y avenidas),543000,"rehabilitación en asfalto caliente de la calle monagas, ubicado en la parroquia san casimiro, municipio san casimiro de estado bolivariano de aragua.","se va a suministrar un total de 279 tn de asfalto en caliente donde las actividades son las siguientes: escarificación del area dañada, limpieza con la barredora, aplicación de riego de adherencia  con material asfaltico liquido rc2, para proceder a la c",Culminado,"19","19","717421","1106055",Rehabilitación o Mejora,2023/04/24,24.55,22118.1262729124,2380,m2,Si,toneladas de asfalto,"279",carpeta,Elementos no asfalticos,,79.2764382541664,no,-67.0140187872175,9.99829298973006,./0.png
-67.0135024712047,10.0052231519929,"316",PI-2023-C-7-E-252-00039391,"2023",C7,ALCALDÍA DE SAN CASIMIRO (EDO. ARAGUA),Central,Aragua,San Casimiro,San Casimiro,Vialidad,Sistemas de Vías de Acceso (calles y avenidas),640000,"asfaltado de la calle los pocitos en la parroquia san casimiro, municipio san casimiro, estado  de aragua.","se va  a escarificar el area dañada y luego se realizara limpieza de la misma con la barredora, se aplicara riego de adherencia con material asfaltico liquido rc2, se va a suministrar un total de 328 ton de asfalto en caliente para ser colocada en carpet",Culminado,"19","19","717673","1106253",Rehabilitación o Mejora,2023/04/24,24.55,26069.2464358452,2800,m2,Si,tonelada de asfalto,"328",carpeta,Elementos no asfalticos,,79.4794098653817,no,-67.0135024712047,10.0052231519929,./0.png
-70.5918372320993,9.30423881352102,"317",PI-2023-C-7-E-266-00039289,"2023",C7,ALCALDÍA DE SAN RAFAEL DE CARVAJAL (EDO. TRUJILLO),Los Andes,Trujillo,San Rafael De Carvajal,Carvajal,Vialidad,"Sistema Vial Nacional (troncal, local, ramal y sub-ramal)",1816080.8,rehabilitación integral y mejoramiento de la vialidad principal del sector la arboleda - la victoria parroquia carvajal del municipio san rafael de carvajal del estado trujillo.,"el proyecto comprende la excavación limpieza, bote de escombros del material proveniente de los deslizamientos, así como la construcción de canales de drenaje (torrenteras) ,cunetas y la colocación de mezcla asfaltica en dos (02) tramos de vías.

",Culminado,"19","19","325187","1028152",Rehabilitación o Mejora,2023/04/21,24.59,73854.4448962993,2334,m2,Si,capa asfaltica (ton),"775",heterogeneo_asf,Elementos no asfalticos,,,no,-70.5918372320993,9.30423881352102,./0.png
-71.1029391546222,9.03632773045136,"318",PI-2023-C-7-E-307-00039242,"2023",C7,ALCALDÍA DE TULIO FEBRES CORDERO (EDO. MÉRIDA),Los Andes,Mérida,Tulio Febres Cordero,Santa Apolonia,Vialidad,Sistemas de Vías de Acceso (calles y avenidas),1541610,rehabilitación de la vía principal del sector la pueblita al peñon de santa apolonia parroquia santa apolonia municipio tulio febres cordero del estado bolivariano de mérida. i fase.,"en vista de la problematica existente en la vialidad que conduce a la población de santa apolonia y sus precarias condiciones, para solventar este problema se debe construir baches y carpetas corridas de rodamiento asfaltico, utilizando como material de",Culminado,"19","19","268594","1002702",Rehabilitación o Mejora,2023/04/21,24.59,62692.5579503863,977,m2,Si,mezcla asfaltica tipo iv,"230",bacheo/carpeta,Elementos no asfalticos,,272.576338914723,no,-71.1029391546222,9.03632773045136,./0.png
