X,Y,fid,corrltv,prd_fsc,ciclo,entidad,redi,estado,municip,parroqu,categor,subctgr,mnt_pry,nmbr_pr,dscrpc_,estts_p,huso_nc,hus_fnl,crd_st_,crd_nr_,tipo_br,fech_nc,cotizcn,mnt_pr_,cntdd__,undd_br,mtrls_c,mtrl_tp,mtrl_cn,clsfccn,motivo,clasi2,costo,atipics,Longitd,Latitud,icon_url
-71.9767031557236,8.12776320022759,"207",PI-2022-C-9-E-131-00038106,"2022",C9,ALCALDÍA DE JÁUREGUI (EDO. TÁCHIRA),Los Andes,Táchira,Jáuregui,Jáuregui,Vialidad,Sistemas de Vías de Acceso (calles y avenidas),310063,"-reasfaltado de carpeta de rodamiento, desde la prolongación de la avenida francisco de caceres hasta la avenida los comuneros, la grita, municipio jaureguí del estado tachira.","el proyecto consta del reasfaltado de carpeta de rodamiento de un importante tramo vial el cual tiene una medidas de 5712.84 m², ubicado en la avenida francisco de caceres hasta la avenida los comuneros, para la ejecucion del proyecto de requiere:
-750",Culminado,"19","19","171548","899897",Rehabilitación o Mejora,2022/08/16,5.96,52023.9932885906,5712.84,m2,Si,asfalto,"750",carpeta,Elementos no asfalticos,,69.3653243847875,no,-71.9767031557236,8.12776320022759,./0.png
-71.99235445241,8.14178578085133,"208",PI-2022-C-9-E-131-00038108,"2022",C9,ALCALDÍA DE JÁUREGUI (EDO. TÁCHIRA),Los Andes,Táchira,Jáuregui,Jáuregui,Vialidad,"Sistema Vial Nacional (troncal, local, ramal y sub-ramal)",393137,"reasfaltado de carpeta de rodamiento  en la  vía principal la quinta ? la grita, desde la termoeléctrica hasta la urbanización kermaria, la grita, municipio jaureguí del estado tachira.
","el proyecto consta del reasfaltado de carpeta de rodamiento de una via de acceso principal a la ciudad, el cual tiene unas medidas de 5832.48 m², ubicado en el sector la quinta, desde la termoelectrica hasta la urbanización quermaria, para la ejecución d",Culminado,"19","19","169595","901395",Rehabilitación o Mejora,2022/08/16,5.96,65962.5838926174,5832.48,m2,Si,asfalto,"950",carpeta,Elementos no asfalticos,,69.4342988343342,no,-71.99235445241,8.14178578085133,./0.png
-71.0363037715103,10.6815185772807,"209",PI-2022-C-9-E-185-00038022,"2022",C9,ALCALDÍA DE MAUROA (EDO. FALCÓN),Occidental,Falcón,Mauroa,Mene De Mauroa,Vialidad,Sistemas de Vías de Acceso (calles y avenidas),644600,"rehabilitación de la vía principal de acceso a mene de mauroa, sector la pringamoza, parroquia mene de mauroa, municipio mauroa, estado falcón (ii etapa)","este proyecto contempla la continuación en una ii etapa para la rehabilitación de 1.800 mts de vialidad con un ancho promedio de 6 mts, los cuales seran ejecutados con la conformación, acondicionamiento, imprimación y riego de adherencia de la superficie",Culminado,"19","19","276020","1182352",Rehabilitación o Mejora,2022/08/16,5.96,108154.362416107,1800,Metros,Si,mezcla de asfalto en caliente (ton),"1738",bacheo/carpeta,Elementos no asfalticos,,62.2292073740549,no,-71.0363037715103,10.6815185772807,./0.png
-71.5150821812031,10.5349360631986,"210",PI-2022-C-9-E-272-00038328,"2022",C9,ALCALDÍA DE SANTA RITA (EDO. ZULIA),Occidental,Zulia,Santa Rita,Santa Rita,Vialidad,Sistemas de Vías de Acceso (calles y avenidas),197665.45,"rehabilitación integral de la vialidad en la calle 14 cruz de mayo con asfaltado desde la avenida 5 padre landaeta hasta la avenida 1 pedro lucas urribarri, sector casco central, parroquia santa rita, municipio santa rita, estado zulia.","consiste en la colocación de carpeta de rodamiento en la vialidad existente, con el uso de maquinaria pesada para asfalto, incluye el suministro, transporte y colocación de 179,66 toneladas de mezcla asfaltica en caliente tipo iii y rc-250 para 1.476,94",Culminado,"19","19","224738","1165844",Rehabilitación o Mejora,2022/08/16,5.96,33165.3439597315,1476.94,m2,Si,toneladas de mezcla asfaltica en caliente tipo iii,"179",carpeta,Elementos no asfalticos,,185.281251171685,no,-71.5150821812031,10.5349360631986,./0.png
-71.2792337401406,9.12249335526407,"211",PI-2022-C-9-E-297-00038017,"2022",C9,ALCALDÍA DE SUCRE (EDO. ZULIA),Occidental,Zulia,Sucre,Heras,Vialidad,Rural,405200.02,"rehabilitación de la vialidad comprendida entre el puente sobre el río tucaní hasta el inicio de la hacienda el consuelo, parroquia heras del municipio sucre del estado zulia.","se rehabilitaran 300 ml de vialidad mediante la colación de 120 toneladas de mezcla asfaltica en caliente tipo iii. incluye el escarificado, bote de escombro y el suministro y colocación del asfalto.",Culminado,"19","19","249791","1009163",Rehabilitación o Mejora,2022/08/17,5.96,67986.5805369127,700,m2,Si,toneladas de mezcla asfaltica en caliente tipo iii,"120",carpeta,Elementos no asfalticos,,566.554837807606,si,-71.2792337401406,9.12249335526407,./0.png
-67.0647004939325,10.584390673328,"212",PI-2022-C-9-E-321-00038121,"2022",C9,ALCALDÍA DE VARGAS (EDO. LA GUAIRA),Central,La Guaira,Vargas,Catia La Mar,Vialidad,Sistemas de Vías de Acceso (calles y avenidas),703056.83,"repavimentacion y demarcacion en el sector las tunitas calle ruiz pineda, parroquia catia la mar, municipio vargas, estado la guaira","escarificacion  de carpeta asfaltica, imprimacion asfaltica empleando 2800 m2 de material asfaltico tipo rc-250, colocacion de mezcla asfaltica en caliente tipo iii, de ancho variable, suministrada en boca de planta, para repavimentacion 644 ton. incluye",Culminado,"19","19","711910","1171043",Rehabilitación o Mejora,2022/08/25,7.82,89904.9654731458,2800,m2,Si,asfalto caliente tipo iii,"644",carpeta,Elementos no asfalticos,,139.603983653953,no,-67.0647004939325,10.584390673328,./0.png
-68.843724565614,10.2472438652261,"213",PI-2022-C-9-E-33-00038089,"2022",C9,ALCALDÍA DE ARÍSTIDES BASTIDAS (EDO. YARACUY),Occidental,Yaracuy,Arístides Bastidas,Capital Arístides Bastidas,Vialidad,Sistemas de Vías de Acceso (calles y avenidas),257840,"colocacion de mezcla asfaltica en caliente mediante bacheo en la calle 5 del sector centro i parroquia san pablo municipio aristides bastidas, estado yaracuy.","consiste en la demolicion de capa de espesor variable( piel de cocodrilo existente), compactacion de material granular para la base, riego de adherencia, y colocacion de asfalto en caliente tipo iv utilizando 150 toneladas, en la calle 5.",Culminado,"19","19","516104","1132977",Rehabilitación o Mejora,2022/08/16,5.96,43261.744966443,800,m2,Si,asfalto en caliente (m2),"800",heterogeneo_asf,Elementos no asfalticos,,,no,-68.843724565614,10.2472438652261,./0.png
-70.9300020913611,9.81196022846403,"214",PI-2022-C-9-E-39-00037937,"2022",C9,ALCALDÍA DE BARALT (EDO. ZULIA),Occidental,Zulia,Baralt,Pueblo Nuevo,Vialidad,Sistemas de Vías de Acceso (calles y avenidas),703200,"rehabilitación integral de la vialidad en el tramo comprendido desde la vía principal de los barrosos hasta la avenida independencia de mene grande parroquias pueblo nuevo y libertador, municipio baralt, estado zulia.","consiste en la colocación de carpeta de rodamiento en la vialidad existente con el uso de maquinaria pesada para asfalto. incluye el suministro, transporte y colocación de 1.000 toneladas de mezcla asfaltica en caliente tipo iii y demarcación horizontal",Culminado,"19","19","290105","1090340",Rehabilitación o Mejora,2022/08/16,5.96,117986.577181208,8700,m2,Si,toneladas de mezcla asfaltica en caliente tipo iii,"1000",carpeta,Elementos no asfalticos,,117.986577181208,no,-70.9300020913611,9.81196022846403,./0.png
-71.6156725995642,8.99072312348071,"215",PI-2023-C-10-E-109-00039642,"2023",C10,ALCALDÍA DE FRANCISCO JAVIER PULGAR (EDO. ZULIA),Occidental,Zulia,Francisco Javier Pulgar,Simón Rodríguez,Vialidad,"Sistema Vial Nacional (troncal, local, ramal y sub-ramal)",1266720,bacheo y carpeta de rodamiento en su primera etapa de la via principal de pueblo nuevo el chivo las rurales prg. 1+300 hasta prog. 4+443 de la parroquia simon rodriguez municipio francisco javier pulgar del estado zulia.,"este proyecto consiste en relizar en su primera etapa un bacheo para corregir fallas existentes en el pavimento como lo son piel de cocodrilo, huecos, desintegracion y disgregacion asfaltica, fallas de borde entre otras, para luego ejecutar una carpeta d",Culminado,"19","19","212461","992314",Rehabilitación o Mejora,2023/06/09,26.95,47002.5974025974,20658,m2,Si,asfalto tipó iv en caliente,"400",bacheo/carpeta,Elementos no asfalticos,,117.506493506494,no,-71.6156725995642,8.99072312348071,./0.png
-68.2189639342072,7.79291511845692,"216",PI-2023-C-12-E-3-00039853,"2023",C12,ALCALDÍA DE ACHAGUAS (EDO. APURE),Los LLanos,Apure,Achaguas,Urbana Achaguas,Vialidad,Sistemas de Vías de Acceso (calles y avenidas),840600,"adquisicion de asfalto para bacheo de la  avenida jose antonio paez, sector el nazareno, parroquia achaguas, municipio achaguas, estado apure.","se comprara asfalto en caliente tipo iv, para colocarlo en la avenida jose antonio paez del sector el nazareno, parroquia achaguas, municipio achaguas estado apure.",Culminado,"19","19","586069","862384",Rehabilitación o Mejora,2023/07/12,28.28,29724.1867043847,76,m2,Si,asfalto tipo iv,"94",bacheo,Elementos no asfalticos,,316.214752174306,no,-68.2189639342072,7.79291511845692,./0.png
-67.0284891404914,10.3844796487793,"217",PI-2023-C-10-E-118-00039541,"2023",C10,ALCALDÍA DE GUAICAIPURO (EDO. MIRANDA),Central,Miranda,Guaicaipuro,Los Teques,Vialidad,Sistemas de Vías de Acceso (calles y avenidas),850730,"rehabilitación de tramo vial que comprende: la avenida pedro russo ferrer hasta barrio venezuela, parroquia los teques, municipio guaicaipuro.","se proyecta la atenciòn de bacheo menor en el circuito vial que inicia desde la av. pedro russo ferrer hasta barrio venezuela. con la intervenciòn de aproximadamente 5.159,57m2 de la carpeta asfaltica.",Culminado,"19","19","716726","1144631",Rehabilitación o Mejora,2023/06/09,26.95,31566.9758812616,5159.57,m2,Si,mezcla asfaltica caliente,"200",bacheo,Elementos no asfalticos,,157.834879406308,no,-67.0284891404914,10.3844796487793,./0.png
-66.9381022915119,10.2694975564069,"218",PI-2023-C-10-E-118-00039542,"2023",C10,ALCALDÍA DE GUAICAIPURO (EDO. MIRANDA),Central,Miranda,Guaicaipuro,Paracotos,Vialidad,Sistemas de Vías de Acceso (calles y avenidas),1765270,"sustitucion de la carpeta asfaltica en la via principal de la zona industrial de paracotos ""la cumaca"", incluye escarificaciòn, s/t/c de mezcla asfaltica en caliente, parroquia paracotos, municipio guaicaipuro.","se proyecta la atenciòn con corte y colocaciòn de 415 toneladas de mezcla asfaltica en caliente, en carpetas corridas, para la intervenciòn de aproximadamente 2.943,26 m2 de la superficie vial.",Culminado,"19","19","724665","1135421",Rehabilitación o Mejora,2023/06/09,26.95,65501.6697588126,2943.26,m2,Si,mezcla asfaltica caliente,"415",carpeta,Elementos no asfalticos,,157.835348816416,no,-66.9381022915119,10.2694975564069,./0.png
-71.6813237827218,10.4164505557139,"219",PI-2023-C-10-E-152-00039628,"2023",C10,ALCALDÍA DE LA CAÑADA DE URDANETA (EDO. ZULIA),Occidental,Zulia,La Cañada De Urdaneta,Concepción,Vialidad,Sistemas de Vías de Acceso (calles y avenidas),2616000,"rehabilitacion vial de la avenida n°1, desde la intendencia municipal hasta la sede de poliurdaneta, sector los pozos, parroquia concepcion, municipio la cañada de urdaneta, estado zulia.","consiste en la rehabilitacion vial de la avenida n°1, en la cual se realizaran trabajos de limpieza, bote, riego de adherencia, colocacion de 513 toneladas de mezcla asfaltica en caliente tipo iii para mejorar una vialidad aproximada de 4.000 m2 con una",Culminado,"19","19","206725","1152983",Rehabilitación o Mejora,2023/06/09,26.95,97068.6456400742,4000,m2,Si,toneladas de mezcla asfaltica en caliente tipo iii,"513",carpeta,Elementos no asfalticos,,189.217632826655,no,-71.6813237827218,10.4164505557139,./0.png
-71.0558570070023,9.15305020114238,"220",PI-2023-C-10-E-297-00039629,"2023",C10,ALCALDÍA DE SUCRE (EDO. ZULIA),Occidental,Zulia,Sucre,Rómulo Gallegos,Vialidad,"Sistema Vial Nacional (troncal, local, ramal y sub-ramal)",2616000,"rehabilitación vial de la carretera panamericana desde la estación de servicios el carmen hasta el estacionamiento vale cacho, sector bomba el carmen parroquia rómulo gallegos, municipio sucre del estado zulia.","consiste en la realización de trabajos de limpieza, bote de escombros, relleno y conformación de la vía, riego de adherencia, colocación de 250 toneladas de mezcla asfaltica en caliente tipo iii para mejorar una vialidad aproximada de 1.200 mts cuadrados",Culminado,"19","19","274206","1012467",Rehabilitación o Mejora,2023/06/09,26.95,97068.6456400742,1200,m2,Si,toneladas de mezcla asfaltica en caliente tipo iii,"250",carpeta,Elementos no asfalticos,,388.274582560297,si,-71.0558570070023,9.15305020114238,./0.png
-66.8969639476992,9.80430500729483,"221",PI-2023-C-10-E-62-00039543,"2023",C10,ALCALDÍA DE CAMATAGUA (EDO. ARAGUA),Central,Aragua,Camatagua,Camatagua,Vialidad,Sistemas de Vías de Acceso (calles y avenidas),2354400,"rehabilitación con bacheo de capa asfaltica  en la entrada principal  de camatagua, sector la recta, de la parroquia camatagua, municipio camatagua, estado aragua.","con este proyecto se pretende rehabilitar un tramo de la entrada principal de camatagua  con 500 toneladas de material asfaltico caliente, para ello se removera  todo el material suelto de asfalto viejo y se limpiara muy bien la zona afectada.
se correg",Culminado,"19","19","729403","1083777",Rehabilitación o Mejora,2023/06/09,26.95,87361.7810760668,4291,m2,Si,toneladas de asfalto,"500",bacheo,Elementos no asfalticos,,174.723562152134,no,-66.8969639476992,9.80430500729483,./0.png
-71.5797816560672,8.73043958588731,"222",PI-2023-C-11-E-351-00039756,"2023",C11,GOBERNACIÓN DE MÉRIDA,Los Andes,Mérida,Alberto Adriani,Héctor Amable Mora,Vialidad,"Sistema Vial Nacional (troncal, local, ramal y sub-ramal)",1491454.82,rehabilitación integral de 720 m2 de la troncal 001 en el sector caño amarillo de la parroquia héctor amable mora del municipio alberto adriani del estado bolivariano de mérida,"rehabilitación integral de 720 m2 de la troncal 001 en el sector caño amarillo de la parroquia héctor amable mora del municipio alberto adriani del estado bolivariano de mérida con la colocación de 135 toneladas de asfalto, reparación del sistema de dren",Culminado,"19","19","216009","965102",Rehabilitación o Mejora,2023/06/27,27.65,53940.4998191682,720,m2,Si,asfalto,"135",carpeta,Elementos no asfalticos,,399.559257919764,si,-71.5797816560672,8.73043958588731,./0.png
-69.0252792376533,9.0707390401484,"223",PI-2023-C-11-E-355-00039783,"2023",C11,GOBERNACIÓN DE PORTUGUESA,Los LLanos,Portuguesa,Santa Rosalía,Capital Santa Rosalía,Vialidad,"Sistema Vial Nacional (troncal, local, ramal y sub-ramal)",4929443.22,"rehabilitación de la vialidad local 04 en la población el playón, municipio santa rosalía, estado portuguesa","consiste en recuperar la vía local 04, realizando las siguientes actividades: riego de adherencia empleando material asfaltico, imprimación de 882 toneladas de asfalto para rehabilitar 8.935 m2, de igual forma la colocación de mezcla asfaltica en calient",Culminado,"19","19","492518","1017655",Rehabilitación o Mejora,2023/06/27,27.65,178280.044122966,8935,m2,Si,mezcla asfaltica en toneladas,"882",carpeta,Elementos no asfalticos,,202.131569300415,no,-69.0252792376533,9.0707390401484,./0.png
-69.4637888593534,8.92408267853502,"224",PI-2023-C-11-E-355-00039784,"2023",C11,GOBERNACIÓN DE PORTUGUESA,Los LLanos,Portuguesa,Guanare,Capital Guanare,Vialidad,"Sistema Vial Nacional (troncal, local, ramal y sub-ramal)",1648736.69,"rehabilitación del tramo vial local 06 comprendido desde la av. josé maría vargas de guanare hasta la entrada de papelón, estado portuguesa.","consiste en recuperar la vía local 06, realizando las siguientes actividades: riego de adherencia empleando material asfaltico, imprimación de 297 toneladas de asfalto para rehabilitar 3.008 m2, de igual forma la colocación de mezcla asfaltica en calient",Culminado,"19","19","419535","997528",Rehabilitación o Mejora,2023/06/27,27.65,59628.8133815552,3008,m2,Si,mezcla asfaltica en toneladas,"297",carpeta,Elementos no asfalticos,,200.770415426112,no,-69.4637888593534,8.92408267853502,./0.png
-70.205435712398,9.8316981061698,"225",PI-2023-C-11-E-358-00039768,"2023",C11,GOBERNACIÓN DE TRUJILLO,Los Andes,Trujillo,Carache,Santa Cruz,Vialidad,"Sistema Vial Nacional (troncal, local, ramal y sub-ramal)",2100000,"rehabilitación de la vialidad, tramo la libertad - limite lara, parroquia santa cruz, municipio carache estado trujillo .","suministro , transporte y colocación de mezcla asfaltica de 6200 tm (carpeta corrida y bacheo)   para una recuperación de aproximadamente 27000 m2 del tramo la libertad - limite lara, parroquia santa cruz, municipio carache estado trujillo .",Aprobado,"19","19","364876","1086008",Rehabilitación o Mejora,2023/06/27,27.65,75949.3670886076,27000,m2,Si,asfalto tipo iii (toneladas),"6200",bacheo/carpeta,Elementos no asfalticos,,12.2498979175174,no,-70.205435712398,9.8316981061698,./0.png
-67.0441456071028,10.5970634255585,"226",PI-2023-C-11-E-359-00039826,"2023",C11,GOBERNACIÓN DE LA GUAIRA,Central,La Guaira,Vargas,Catia La Mar,Vialidad,Sistemas de Vías de Acceso (calles y avenidas),4916220.27,"rehabilitación integral de la vialidad desde la entrada a la panadería bahía de catamare  hasta la cancha de catamare   y la construccion de tanquilla de concreto para captación de aguas pluviales en el mismo sector comunas las marinas, parroquia  catia","consiste en la escarificación de la vía, e imprimación de 180 toneladas de asfalto para rehabilitar 2560 m2 en este tramo vial, empleando maquinaria pesada tipo vibro-compactador, escarificadora, camión tipo volteo y pavimentadora. incluye demarcación a",Culminado,"19","19","713690","1172006",Rehabilitación o Mejora,2023/07/04,28.09,175016.741545034,2560,m2,Si,material asfaltico tipo rc-250 (ton),"180",heterogeneo_asf,Por descripción,,,no,-67.0441456071028,10.5970634255585,./0.png
-71.6610524920063,10.5733071057012,"227",PI-2023-C-11-E-361-00039793,"2023",C11,GOBERNACIÓN DE ZULIA,Occidental,Zulia,San Francisco,Domitila Flores,Vialidad,Sistemas de Vías de Acceso (calles y avenidas),3351750,"reasfaltado de la vía a perija en el tramo comprendido desde balgres ceramicas hasta ferretería bicolor, parroquia domitila flores, municipio san francisco, estado zulia.","se plantea el reasfaltado de 1142 metros lineales  de vía, en varios tramos deteriorados (ancho variable), a través de las actividades de:  limpieza a mano en calzada  y riego de adherencia con rc250 en un area de 14.832 m2, suministro, transporte y colo",Culminado,"19","19","209677","1170875",Rehabilitación o Mejora,2023/06/27,27.65,121220.61482821,14832,m2,Si,toneladas de asfalto en caliente tipo iii,"1705",carpeta,Elementos no asfalticos,,71.097134796604,no,-71.6610524920063,10.5733071057012,./0.png
-71.6901696337637,10.7031079490152,"228",PI-2023-C-11-E-361-00039794,"2023",C11,GOBERNACIÓN DE ZULIA,Occidental,Zulia,Maracaibo,Venancio Pulgar,Vialidad,Sistemas de Vías de Acceso (calles y avenidas),3729625.75,"rehabilitación de la calle de servicio del corredor vial el marite (av.108a), desde la estación de servicio el marite hasta la calle 72 del barrio jose felix rivas, parroquia venancio pulgar, municipio maracaibo, estado zulia.","se plantea el reasfaltado de 100 metros lineales  de vía asi como el asfaltado de 1141 metros lineales en tramos deteriorados (ancho variable), a través de las siguientes actividades: 880 m2 de limpieza a mano en calzada, riego de adherencia con rc250 en",Culminado,"19","19","204996","1183244",Rehabilitación o Mejora,2023/06/27,27.65,134887.007233273,9444,m2,Si,toneladas de mezcla asfaltica en caliente tipo iii,"1459",carpeta,Elementos no asfalticos,,92.4516841900432,no,-71.6901696337637,10.7031079490152,./0.png
-71.442578686402,10.4082417058288,"229",PI-2023-C-11-E-361-00039804,"2023",C11,GOBERNACIÓN DE ZULIA,Occidental,Zulia,Cabimas,San Benito,Vialidad,Sistemas de Vías de Acceso (calles y avenidas),1747242.75,"reasfaltado en tramos críticos de la av. 32, comprendidos entre las carreteras j y h, parroquia san benito, municipio cabimas, estado zulia.","se prevee el reasfaltado de tramos criticos en una longitud de vía de 850 m, a través de la limpieza en calzada, riego de adherencia con rc-250 en un area de 8500 m2, colocación de 1000 toneladas de mezcla asfaltica en caliente tipo iii para carpetas de",Culminado,"19","19","233262","1150364",Rehabilitación o Mejora,2023/06/27,27.65,63191.4195298373,8500,m2,Si,toneladas de mezcla asfaltica en caliente tipo iii,"1000",carpeta,Elementos no asfalticos,,63.1914195298373,no,-71.442578686402,10.4082417058288,./0.png
-71.6222636606501,10.6390569854752,"230",PI-2023-C-11-E-361-00039805,"2023",C11,GOBERNACIÓN DE ZULIA,Occidental,Zulia,Maracaibo,Chiquinquirá,Vialidad,Sistemas de Vías de Acceso (calles y avenidas),2391160.25,"reasfaltado de la calle 100, entre las avenidas.13a y 17 (sentido este - oeste), sector casco central, parroquia chiquinquira, municipio maracaibo, estado zulia.","se plantea el reasfaltado de 1,38 kms con un ancho promedio de 13,80 mts de vialidad, mediante la limpieza de calzada en un area de12.545 m2, riego de adherencia con rc-250, colocación de 1.443 ton de mezcla asfaltica en caliente tipo iii para la constru",Culminado,"19","19","213741","1177378",Rehabilitación o Mejora,2023/06/27,27.65,86479.575045208,12545,m2,Si,toneladas de asfalto en caliente tipo iii,"1443",carpeta,Elementos no asfalticos,,59.9304054367346,no,-71.6222636606501,10.6390569854752,./0.png
-71.3572536691273,10.2613402812137,"231",PI-2023-C-11-E-361-00039936,"2023",C11,GOBERNACIÓN DE ZULIA,Occidental,Zulia,Simón Bolívar,Manuel Manrique,Vialidad,Sistemas de Vías de Acceso (calles y avenidas),732996.33,"reasfaltado en tramos critícos del corredor vial carretera e, entre las intersecciones con las avenidas intercomunal y 23, parroquia manuel manrique, municipio simón bolívar, estado zulia","se contempla el reasfaltado de tramos críticos deteriorados en una longitud de 450 m, a traves de la limpieza de 3.470 m2 en calzada, riego de adherencia con rc-250 y colocación de 400 toneladas de mezcla asfaltica en caliente tipo iii, para carpeta de r",Culminado,"19","19","240699","1134622",Rehabilitación o Mejora,2023/06/27,27.65,26509.8130198915,3470,m2,Si,toneladas de asfalto en caliente tipo iii,"400",carpeta,Elementos no asfalticos,,66.2745325497288,no,-71.3572536691273,10.2613402812137,./0.png
-71.9516490814051,11.3031575251232,"232",PI-2023-C-12-E-119-00039910,"2023",C12,ALCALDÍA DE GUAJIRA (EDO. ZULIA),Occidental,Zulia,Indígena Bolivariano Guajira,Guajira,Vialidad,"Sistema Vial Nacional (troncal, local, ramal y sub-ramal)",2110130.69,"bacheo con mezcla   asfaltica en caliente con equipo liviano y pesado en la troncal del caribe t6, en tramos criticos, desde el sector las guardias hasta los aceitunitos, parroquia guajira, municipio indigena bolivariano guajira, estado zulia, fase 1.","el proyecto contempla el bacheo con equipo liviano y pesado para remover el pavimento en la troncal del caribe en tramos criticos,colocando 325 toneladas de mezcla asfaltica en caliente, beneficiando a una gran flujo vehicular que transitan  a diario por",Culminado,"19","19","182282","1238917",Rehabilitación o Mejora,2023/07/12,28.28,74615.6538189533,2000,m2,Si,toneladas de mezcla asfaltica en caliente tipo iii,"325",bacheo,Elementos no asfalticos,,229.586627135241,no,-71.9516490814051,11.3031575251232,./0.png
-68.7509632558802,10.3230499537604,"233",PI-2023-C-12-E-128-00039871,"2023",C12,ALCALDÍA DE INDEPENDENCIA (EDO. YARACUY),Occidental,Yaracuy,Independencia,Capital Independencia,Vialidad,Sistemas de Vías de Acceso (calles y avenidas),1980481.08,rehabilitación de la carpeta asfaltica del terminal de pasajeros independencia en el sector brisas del terminal del municipio independencia estado yaracuy,"consiste en la rehabilitación de la carpeta asfaltica mediante bacheos con mezcla asfaltica en caliente en el patio de andenes del terminal de pasajeros independencia del municipio independencia. correspondiente a 1953,60 metros cuadrados",Culminado,"19","19","527366","1141230",Rehabilitación o Mejora,2023/07/12,28.28,70031.1555869873,1953.6,m2,Si,mezcla asfaltica en caliente (toneladas),"320",bacheo,Elementos no asfalticos,,218.847361209335,no,-68.7509632558802,10.3230499537604,./0.png
-70.9521934810701,9.25930091457888,"234",PI-2023-C-12-E-149-00039845,"2023",C12,ALCALDÍA DE JULIO CÉSAR SALAS (EDO. MÉRIDA),Los Andes,Mérida,Julio César Salas,Arapuey,Vialidad,Sistemas de Vías de Acceso (calles y avenidas),1260944,"rehabilitación integral de 5000m2 de la avenida n° 02, boulevart, del casco central de arapuey, de la parroquia arapuey del municipio julio cesar salas estado mérida","rehabilitación integral de 5000m2 de la av 02, buolevart de arapuey, donde se van a realizar la construcción vialidad de 3 metros de ancho con un espesor de 10mm, con sus respectivas aceras, brocales, alcantarillas y bacheo de los sectores que se encuent",Aprobado,"19","19","285401","1023747",Rehabilitación o Mejora,2023/07/12,28.28,44587.8359264498,5000,m2,Si,asfalto caliente,"5",heterogeneo_asf,Elementos no asfalticos,,,no,-70.9521934810701,9.25930091457888,./0.png
