X,Y,fid,corrltv,prd_fsc,ciclo,entidad,redi,estado,municip,parroqu,categor,subctgr,mnt_pry,nmbr_pr,dscrpc_,estts_p,huso_nc,hus_fnl,crd_st_,crd_nr_,tipo_br,fech_nc,cotizcn,mnt_pr_,cntdd__,undd_br,mtrls_c,mtrl_tp,mtrl_cn,clsfccn,motivo,clasi2,costo,atipics,Longitd,Latitud,icon_url
-72.2025105315204,7.75948134081636,"1",PI-2022-C-1-E-253-00036311,"2022",C1,ALCALDÍA DE SAN CRISTÓBAL (EDO. TÁCHIRA),Los Andes,Táchira,San Cristóbal,La Concordia,Vialidad,"Sistema Vial Nacional (troncal, local, ramal y sub-ramal)",251640,"i etapa de rehabiitación de la vialidad del sector via loma de pío-chorro del indio, municipio san cristóbal.","en esta primera etapa se colocaran 600 toneladas de mezcla asfaltica tipo iv en la ro14, vía chorro del indio, mediante la reparación de carpetas y bacheo. de igual manera se realizara la reparación de los sistemas de drenaje.",Culminado,"18","18","807371","858661",Rehabilitación o Mejora,2022/02/17,4.39,57321.1845102506,600,Toneladas,,,,heterogeneo_asf,Elementos no asfalticos,heterogeneo_asfC8,,no,-72.2025105315204,7.75948134081636,./0.png
-72.219853492228,7.8274232505453,"2",PI-2022-C-1-E-357-00036202,"2022",C1,GOBERNACIÓN DE TÁCHIRA,Los Andes,Táchira,Cárdenas,Cárdenas,Vialidad,"Sistema Vial Nacional (troncal, local, ramal y sub-ramal)",580127.56,"rehabilitación de carpeta asfaltica desde la bomba el diamante hasta la panaderia el viajero, parroquia capital, municipio cardenas, estado tachira.","se preve la ejecucion de una serie de actividades enmarcadas dentro de la construccion de carpeta asfatica de 0.30 kilometros de vialidad, entre las cuales destacan: bacheo localizado con mezclas asfalticas en caliente, beneficiando una población de
122",Culminado,"18","18","807011","865867",Rehabilitación o Mejora,2022/02/09,4.48,129492.758928571,300,Metros,,,,heterogeneo_asf,Elementos no asfalticos,heterogeneo_asfC8,,no,-72.219853492228,7.8274232505453,./0.png
-72.239203960274,8.01946273843661,"3",PI-2022-C-1-E-38-00036269,"2022",C1,ALCALDÍA DE AYACUCHO (EDO. TÁCHIRA),Los Andes,Táchira,Ayacucho,Ayacucho,Vialidad,Sistemas de Vías de Acceso (calles y avenidas),33222,"mejoramiento de vialidad, la san juana (parte baja).tramo comprendido desde el cdi-colon hasta la escuela la san juana.","el proyecto consiste en: remoción de capa asfaltica. bacheo, y cancelación de transporte.",Culminado,"18","18","803629","887822",Rehabilitación o Mejora,2022/02/17,4.39,7567.65375854214,70,Toneladas,,,,heterogeneo_asf,Elementos no asfalticos,heterogeneo_asfC8,,no,-72.239203960274,8.01946273843661,./0.png
-72.2452708584337,8.02983990951105,"4",PI-2022-C-1-E-38-00036270,"2022",C1,ALCALDÍA DE AYACUCHO (EDO. TÁCHIRA),Los Andes,Táchira,Ayacucho,Ayacucho,Vialidad,Sistemas de Vías de Acceso (calles y avenidas),83573.75,"mejoramiento de vialidad, las flores, carrera 2. tramo comprendido desde la calle 1 hasta la calle 5.","el proyecto consiste en: remoción de capa asfaltica. bacheo, y cancelación de transporte.",Culminado,"18","18","803146","888331",Rehabilitación o Mejora,2022/02/17,4.39,19037.3006833713,298,Toneladas,,,,heterogeneo_asf,Elementos no asfalticos,heterogeneo_asfC8,,no,-72.2452708584337,8.02983990951105,./0.png
-72.2507207318719,8.02553032396173,"5",PI-2022-C-1-E-38-00036273,"2022",C1,ALCALDÍA DE AYACUCHO (EDO. TÁCHIRA),Los Andes,Táchira,Ayacucho,Ayacucho,Vialidad,Sistemas de Vías de Acceso (calles y avenidas),83573.75,"mejoramiento de vialidad, barrio urdaneta, calle 3. tramo comprendido desde la carrera 0 hasta la carrera 4.","el proyecto consiste en: remoción de capa asfaltica. bacheo, y cancelación de transporte.",Culminado,"18","18","802666","888309",Rehabilitación o Mejora,2022/02/17,4.39,19037.3006833713,298,Toneladas,,,,heterogeneo_asf,Elementos no asfalticos,heterogeneo_asfC8,,no,-72.2507207318719,8.02553032396173,./0.png
-72.2207420872374,7.82732068638963,"6",PI-2022-C-10-E-357-00038212,"2022",C10,GOBERNACIÓN DE TÁCHIRA,Los Andes,Táchira,Cárdenas,Cárdenas,Vialidad,"Sistema Vial Nacional (troncal, local, ramal y sub-ramal)",1945191.92,"rehabilitación de la carpeta asfaltica  tramo 1 autopista  san cristobal la fría desde el puente libertador hasta la panadería viajero, sentido norte - sur ,parroquia capital municipio cardenas estado tachira","se prevee  la ejecución de una serie de actividades para la rehabilitación de carpeta asfaltica en caliente en una superficie de 5.100 metros cuadrados (m2),  de vialidad así como también la demarcación de la vía, beneficiando a una población de 122.053",Culminado,"18","18","805770","864686",Rehabilitación o Mejora,2022/09/14,8.01,242845.433208489,5100,m2,Si,asfalto (tn),"1900",carpeta,Elementos no asfalticos,,127.813385899205,no,-72.2207420872374,7.82732068638963,./0.png
-72.318354030729,7.82435662001925,"7",PI-2022-C-11-E-160-00038267,"2022",C11,ALCALDÍA DE LIBERTAD (EDO. TÁCHIRA),Los Andes,Táchira,Capacho Viejo,Libertad,Vialidad,Sistemas de Vías de Acceso (calles y avenidas),90000,"rehabilitación  de la capa asfaltica, carrera 2, parroquia capital, municipio capacho viejo, estado tachira 
","se realizaran los  trabajos de ""bacheo""  en la carrera 2 del  casco central de la parroquia capital, en una superficie total de 9000 m2, así como la demarcación de 1,5 km lineales por  10 cm de ancho.",Culminado,"18","18","794782","865020",Rehabilitación o Mejora,2022/09/26,8.08,11138.6138613861,9000,m2,Si,asfalto caliente en toneladas,"20",bacheo,Elementos no asfalticos,,556.930693069307,si,-72.318354030729,7.82435662001925,./0.png
-72.3197837647915,7.82465486226287,"8",PI-2022-C-11-E-160-00038272,"2022",C11,ALCALDÍA DE LIBERTAD (EDO. TÁCHIRA),Los Andes,Táchira,Capacho Viejo,Libertad,Vialidad,Sistemas de Vías de Acceso (calles y avenidas),90000,"rehabilitación  de la capa asfaltica, carrera 3, parroquia capital, municipio capacho viejo, estado tachira 
","se realizaran los trabajos de ""bacheo"" en la carrera 3 del casco central de la parroquia capital, en una superficie de 6000 m2, así como la demarcación de 1 km lineal por 10 cm de ancho.",Culminado,"18","18","794841","865220",Rehabilitación o Mejora,2022/09/26,8.08,11138.6138613861,6000,Metros,Si,asfalto caliente en toneladas,"10",bacheo,Elementos no asfalticos,,1113.86138613861,si,-72.3197837647915,7.82465486226287,./0.png
-72.3225784249369,7.82263046595023,"9",PI-2022-C-11-E-160-00038274,"2022",C11,ALCALDÍA DE LIBERTAD (EDO. TÁCHIRA),Los Andes,Táchira,Capacho Viejo,Libertad,Vialidad,Sistemas de Vías de Acceso (calles y avenidas),110000,"rehabilitación  de la capa asfaltica, avenida circunvalación, parroquia capital, municipio capacho viejo, estado tachira 
","se realizara trabajos de ""bacheo"" en la av. circunvalación del casco central, parroquia capital en una superficie total de 12.000 m2 así como la demarcación de 2 kilómetros lineales por 10 cm de ancho.",Culminado,"18","18","795989","865851",Rehabilitación o Mejora,2022/09/26,8.08,13613.8613861386,12000,m2,Si,asfalto caliente en toneladas,"20",bacheo,Elementos no asfalticos,,680.693069306931,si,-72.3225784249369,7.82263046595023,./0.png
-72.3279935954314,7.82741779024349,"10",PI-2022-C-11-E-160-00038277,"2022",C11,ALCALDÍA DE LIBERTAD (EDO. TÁCHIRA),Los Andes,Táchira,Capacho Viejo,Libertad,Vialidad,"Sistema Vial Nacional (troncal, local, ramal y sub-ramal)",125000,"rehabilitación  de la capa asfaltica, vía intercomunal, parroquia capital, municipio capacho viejo, estado tachira","se realizara trabajos de ""bacheo"" en la vía intercomunal del casco central de la parroquia capital, en una superficie de 18.000 m2 así como la demarcación de 2.5 km lineales por 10 cm de ancho. colocación de 1500 ojos de gato.",Culminado,"18","18","796184","865777",Rehabilitación o Mejora,2022/09/26,8.08,15470.297029703,18000,m2,Si,asfalto caliente en toneladas,"10",bacheo,Elementos no asfalticos,,1547.0297029703,si,-72.3279935954314,7.82741779024349,./0.png
-72.2491960593567,8.20166582064052,"11",PI-2022-C-13-E-357-00038602,"2022",C13,GOBERNACIÓN DE TÁCHIRA,Los Andes,Táchira,García De Hevia,Capital García De Hevia,Vialidad,"Sistema Vial Nacional (troncal, local, ramal y sub-ramal)",227506.35,"rehabilitación de la av. aeropuerto desde el portal entrada a la fría hasta la carrera 00, parroquia la fría, municipio garcía de hevia, estado tachira.","el proyecto contempla la colocación de material tipo rc2 mezcla asfaltica en caliente para la colocación en sitio de 461 toneladas,  para beneficiar a una población de 48.475.",Culminado,"18","18","802816","910431",Rehabilitación o Mejora,2022/11/17,9.77,23286.2180143296,691,m2,Si,mezcla asfaltica iii (toneladas ),"461",heterogeneo_asf,Elementos no asfalticos,,,no,-72.2491960593567,8.20166582064052,./0.png
-72.0436491550678,8.06565034289961,"12",PI-2022-C-3-E-140-00036482,"2022",C3,ALCALDÍA DE JOSÉ MARÍA VARGAS (EDO. TÁCHIRA),Los Andes,Táchira,José María Vargas,José María Vargas,Vialidad,"Sistema Vial Nacional (troncal, local, ramal y sub-ramal)",77665.24,rehabilitación de la via troncal t0o7 desde el sector anatolio perez hasta el sector la escuela  de la aldea angostura del  municipio dr. jose maria vargas del estado tachira,"este proyecto contempla la rehabilitación de la via troncal too7 que comunica al cobre con la grita específicamente desde el sector anatolio perez hasta el sector la escuela de la aldea angostura del municipio jose maria vargas del estado tachira, este p",Culminado,"18","18","825403","891660",Rehabilitación o Mejora,2022/03/28,4.36,17813.128440367,200,Metros,,,,heterogeneo_asf,Elementos no asfalticos,heterogeneo_asfC8,,no,-72.0436491550678,8.06565034289961,./0.png
-72.2475037405474,8.2011482783603,"13",PI-2022-C-4-E-112-00036937,"2022",C4,ALCALDÍA DE GARCÍA DE HEVIA (EDO. TÁCHIRA),Los Andes,Táchira,García De Hevia,Capital García De Hevia,Vialidad,"Sistema Vial Nacional (troncal, local, ramal y sub-ramal)",333227.4,"rehabilitacion y embellecimiento con asfaltado en la troncal 001 desde la cruz de la mision hasta la calle 04 del sector los cedros, la fria municipio garcia de hevia, la fria estado tachira",rehabilitacion de 350 mts. de la vialidad troncal 001 con mezcla asfaltica en caliente para colocacion carpeta corrida con maquinaria pesada,Culminado,"18","18","803306","907778",Rehabilitación o Mejora,2022/05/02,4.5,74050.5333333333,350,Metros,Si,mezcla asfaltica caliente (ton),"770",heterogeneo_asf,Elementos no asfalticos,heterogeneo_asfC8,,no,-72.2475037405474,8.2011482783603,./0.png
-72.4428667448977,7.8570934962941,"14",PI-2022-C-3-E-52-00036578,"2022",C3,ALCALDÍA DE BOLÍVAR (EDO. TÁCHIRA),Los Andes,Táchira,Bolívar,Bolívar,Vialidad,"Sistema Vial Nacional (troncal, local, ramal y sub-ramal)",39441.37,"bacheo de la capa asfaltica de la vía principal de san antonio del tachira desde la alcabala de peracal hasta palotal, del municipio bolívar del estado tachira",colocación de 20 toneladas de asfalto caliente para el bacheo en la vía principal de san antonio del tachira,Culminado,"18","18","783218","862277",Rehabilitación o Mejora,2022/03/28,4.36,9046.18577981651,20,Toneladas,,,,heterogeneo_asf,Elementos no asfalticos,heterogeneo_asfC8,,no,-72.4428667448977,7.8570934962941,./0.png
-72.5476430979579,10.0593257974692,"15",PI-2022-C-4-E-172-00036947,"2022",C4,ALCALDÍA DE MACHIQUES DE PERIJÁ (EDO. ZULIA),Occidental,Zulia,Machiques De Perijá,Libertad,Vialidad,Sistemas de Vías de Acceso (calles y avenidas),228514,"rehabilitación de la vialidad con bacheo, en la av. santa teresa entre; calle la marina y la florida. sector casco central. parroquia libertad, municipio machiques de perija, edo zulia.","bacheo de la vialidad, utilizando mezcla asfaltica en caliente tipo iii (120-150), con rc-250 .",Culminado,"18","18","767677","1113036",Rehabilitación o Mejora,2022/05/02,4.5,50780.8888888889,230,Toneladas,,,,heterogeneo_asf,Elementos no asfalticos,heterogeneo_asfC8,,no,-72.5476430979579,10.0593257974692,./0.png
-72.2487871243453,7.83515774395571,"16",PI-2022-C-4-E-357-00036772,"2022",C4,GOBERNACIÓN DE TÁCHIRA,Los Andes,Táchira,Guásimos,Capital Guásimos,Vialidad,"Sistema Vial Nacional (troncal, local, ramal y sub-ramal)",1335848.99,"rehabilitación de carpeta asfaltica desde la fabrica nacional de cementos hacia copa de oro, parroquia capital, municipio guasimos estado tachira
","se prevé la ejecución de una serie de actividades enmarcadas en la rehabilitación de la carpeta asfaltica de 0.30 kilómetros de 
vialidad, entre las cuales destacan: bacheo localizado con mezclas asfalticas en caliente, beneficiando una población de 
4",Culminado,"18","18","802521","870192",Rehabilitación o Mejora,2022/04/21,4.43,301546.047404063,300,Metros,,,,heterogeneo_asf,Elementos no asfalticos,heterogeneo_asfC8,,no,-72.2487871243453,7.83515774395571,./0.png
-72.2226026538873,7.82957371058529,"17",PI-2022-C-4-E-68-00036941,"2022",C4,ALCALDÍA DE CÁRDENAS (EDO. TÁCHIRA),Los Andes,Táchira,Cárdenas,Cárdenas,Vialidad,Sistemas de Vías de Acceso (calles y avenidas),29985.7,"bacheo en calle 14 desde aldea universitaria hasta la carrera 16, municipio cardenas, estado tachira",colocación de 50 toneladas de mezcla asfaltica en caliente en bacheo en 1054 ml de calle utilizando rc2 y equipo liviano,Culminado,"18","18","806875","865773",Rehabilitación o Mejora,2022/05/02,4.5,6663.48888888889,1054,Metros,Si,mezcla  asfaltica en  caliente,"50",heterogeneo_asf,Elementos no asfalticos,heterogeneo_asfC8,,no,-72.2226026538873,7.82957371058529,./0.png
-72.2253591129463,7.82378213863042,"18",PI-2022-C-4-E-68-00036944,"2022",C4,ALCALDÍA DE CÁRDENAS (EDO. TÁCHIRA),Los Andes,Táchira,Cárdenas,Cárdenas,Vialidad,Sistemas de Vías de Acceso (calles y avenidas),29999.8,"bacheo en calle 7  de tariba desde avenida 1 hasta barrio zulia, municipio cardenas , estado tachira",colocación de 50 toneladas de mezcla asfaltica en caliente en bacheo en 900 mil de la calle utilizando rc2 y equipo liviano,Culminado,"18","18","806412","865007",Rehabilitación o Mejora,2022/05/02,4.5,6666.62222222222,900,Metros,Si,mezcla  asfaltica en  caliente,"50",heterogeneo_asf,Elementos no asfalticos,heterogeneo_asfC8,,no,-72.2253591129463,7.82378213863042,./0.png
-72.1698180070916,7.85632731297045,"19",PI-2022-C-6-E-15-00037500,"2022",C6,ALCALDÍA DE ANDRÉS BELLO (EDO. TÁCHIRA),Los Andes,Táchira,Andrés Bello,Capital Andrés Bello,Vialidad,Sistemas de Vías de Acceso (calles y avenidas),98730.16,rehabilitacion de la capa asfaltica de la avenida cristobal mendoza de cordero municipio andres bello del estado tachira,"se realizara bacheo, demarcacion y señalizacion de la avenida cristobal mendoza de cordero en un tramo de 1500 metros",Culminado,"18","18","810502","869165",Rehabilitación o Mejora,2022/06/09,5.25,18805.7447619048,1500,Metros,Si,asfalto caliente,"20",heterogeneo_asf,Elementos no asfalticos,heterogeneo_asfC8,,no,-72.1698180070916,7.85632731297045,./0.png
-72.1719465476006,7.85776917095262,"20",PI-2022-C-6-E-15-00037503,"2022",C6,ALCALDÍA DE ANDRÉS BELLO (EDO. TÁCHIRA),Los Andes,Táchira,Andrés Bello,Capital Andrés Bello,Vialidad,Sistemas de Vías de Acceso (calles y avenidas),82915.25,rehabilitacion de la capa asfaltica de la calle principal de cordero municipio andres bello del estado tachira,"se realizara bacheo, demarcacion y señalizacion enla calle principal de cordero en un tramo de 1000 metros",Culminado,"18","18","810491","869156",Rehabilitación o Mejora,2022/06/09,5.25,15793.380952381,1000,Metros,Si,asfalto caliente,"16",heterogeneo_asf,Elementos no asfalticos,heterogeneo_asfC8,,no,-72.1719465476006,7.85776917095263,./0.png
-72.1779511830325,7.85815289564496,"21",PI-2022-C-6-E-15-00037507,"2022",C6,ALCALDÍA DE ANDRÉS BELLO (EDO. TÁCHIRA),Los Andes,Táchira,Andrés Bello,Capital Andrés Bello,Vialidad,Sistemas de Vías de Acceso (calles y avenidas),71854.59,"rehabilitacion de la capa asfaltica de la avenida bolivar de cordero, municipio andres bello del estado tachira","se relizara bacheo, demarcacion y señalizacion de la avenida bolivar de cordero en un tramo de 800 metros",Culminado,"18","18","810534","869193",Rehabilitación o Mejora,2022/06/09,5.25,13686.5885714286,800,Metros,Si,asfalto caliente,"18",heterogeneo_asf,Elementos no asfalticos,heterogeneo_asfC8,,no,-72.1779511830325,7.85815289564496,./0.png
-72.4326281946579,7.92573786984412,"22",PI-2022-C-8-E-226-00037770,"2022",C8,ALCALDÍA DE PEDRO MARÍA UREÑA (EDO. TÁCHIRA),Los Andes,Táchira,Pedro María Ureña,Pedro María Ureña,Vialidad,Sistemas de Vías de Acceso (calles y avenidas),167670,"mantenimiento y mejoramiento de la vialidad desde el arco de tienditas hasta, la vía colon con calle 7 del municipio pedro maría ureña estado tachira.","la ejecución de esta obra tendra como objetivo principal, la recuperación de la malla vial de las vías de acceso y salida realizando trabajos de bacheo desde el arco de tienditas hasta, la vía colon con calle 7 del municipio pedro maría ureña estado tach",Culminado,"18","18","782163","870442",Rehabilitación o Mejora,2022/07/14,5.66,29623.6749116608,13800,Metros,Si,asfalto,"450",heterogeneo_asf,Elementos no asfalticos,heterogeneo_asfC8,,no,-72.4326281946579,7.92573786984412,./0.png
-72.3594575261648,7.69925484087466,"23",PI-2022-C-9-E-150-00037974,"2022",C9,ALCALDÍA DE JUNÍN (EDO. TÁCHIRA),Los Andes,Táchira,Junín,Junín,Vialidad,Sistemas de Vías de Acceso (calles y avenidas),351600,"rehabilitacion y mejora de la capa asfaltica de la av 13 sector san martin, de la parroquia junin municipio junin",rehabilitacion y mejora de 265 metros de capa asfaltica de la av 13 sector san martin desde el puente de san diego hasta el mercado los parrilleros,Culminado,"18","18","791153","852135",Rehabilitación o Mejora,2022/08/16,5.96,58993.288590604,1325,m2,Si,asfalto caliente por tonelada,"750",carpeta,Elementos no asfalticos,,78.6577181208054,no,-72.3594575261648,7.69925484087466,./0.png
-72.2571108757761,8.02832881028164,"24",PI-2022-C-9-E-38-00038042,"2022",C9,ALCALDÍA DE AYACUCHO (EDO. TÁCHIRA),Los Andes,Táchira,Ayacucho,Ayacucho,Vialidad,Sistemas de Vías de Acceso (calles y avenidas),71106,"mejoramiento de vialidad. sector el centro, calle 5. tramo comprendido desde la carrera 4 hasta la carrera 13. san juan de colón, municipio ayacucho.","el proyecto consiste en: remoción de capa asfaltica. compra y colocación de 150 toneladas de asfalto caliente, equivalente a 65.34 m3. compra de 225 litros de rc-250. cancelación de trece fletes para el traslado del material asfaltico.  para alcanzar la",Culminado,"18","18","801640","888983",Rehabilitación o Mejora,2022/08/16,5.96,11930.5369127517,544.5,m2,Si,asfalto caliente (toneladas),"150",carpeta,Elementos no asfalticos,,79.5369127516779,no,-72.2571108757761,8.02832881028164,./0.png
-72.2471009017226,8.04344146714687,"25",PI-2022-C-9-E-38-00038051,"2022",C9,ALCALDÍA DE AYACUCHO (EDO. TÁCHIRA),Los Andes,Táchira,Ayacucho,Ayacucho,Vialidad,Sistemas de Vías de Acceso (calles y avenidas),140423.3,"mejoramiento de vialidad. sector sesquicentenaria, carrera a1. tramo comprendido desde la avenida universidad hasta la calle a2. san juan de colón, municipio ayacucho.","el proyecto consiste en: nivelación, replanteo de terreno y colocación de pavimento asfaltico. compra y colocación de 300 toneladas de asfalto caliente, equivalente a 130.68 m3. compra de 450 litros de rc-250. cancelación de veinticinco fletes para el tr",Culminado,"18","18","803258","890147",Rehabilitación o Mejora,2022/08/16,5.96,23560.9563758389,1089,m2,Si,asfalto caliente (toneladas),"300",carpeta,Elementos no asfalticos,,78.5365212527964,no,-72.2471009017226,8.04344146714687,./0.png
-72.2489056146985,8.04736591554442,"26",PI-2022-C-9-E-38-00038054,"2022",C9,ALCALDÍA DE AYACUCHO (EDO. TÁCHIRA),Los Andes,Táchira,Ayacucho,Ayacucho,Vialidad,Sistemas de Vías de Acceso (calles y avenidas),94212,"mejoramiento de vialidad. barrio ramón j. velasquez. calle francisco de paula reina. tramo comprendido desde la carrera regina de velasquez hasta la carrera 3. san juan de colón, municipio ayacucho.","el proyecto consiste en: remoción de capa asfaltica. compra y colocación de 200 toneladas de asfalto caliente, equivalente a 87.48 m3. compra de  300 litros de rc-250. cancelación de dieciséis fletes para el traslado del material asfaltico.  para alcanza",Culminado,"18","18","803105","890620",Rehabilitación o Mejora,2022/08/16,5.96,15807.3825503356,729,m2,Si,asfalto caliente (toneladas),"200",carpeta,Elementos no asfalticos,,79.0369127516779,no,-72.2489056146985,8.04736591554442,./0.png
-72.266750836253,8.03453718810768,"27",PI-2022-C-9-E-38-00038056,"2022",C9,ALCALDÍA DE AYACUCHO (EDO. TÁCHIRA),Los Andes,Táchira,Ayacucho,Ayacucho,Vialidad,Sistemas de Vías de Acceso (calles y avenidas),48346.32,"mejoramiento vial de la carrera a en el tramo comprendido desde  la calle 3 hasta la calle 4 del  sector la floresta, parroquia  san juan de colón, municipio ayacucho.","el proyecto consiste en: remoción de capa asfaltica. compra y colocación de 100 toneladas de asfalto caliente, equivalente a 43.74 m3. compra de 169 litros de rc-250. cancelación de ocho fletes para el traslado del material asfaltico.  para alcanzar la m",Culminado,"18","18","801159","889086",Rehabilitación o Mejora,2022/08/16,5.96,8111.79865771812,364.5,m2,Si,asfalto caliente (toneladas),"100",carpeta,Elementos no asfalticos,,81.1179865771812,no,-72.266750836253,8.03453718810768,./0.png
-72.2704788898554,7.64800672812768,"28",PI-2023-C-10-E-83-00039630,"2023",C10,ALCALDÍA DE CÓRDOBA (EDO. TÁCHIRA),Los Andes,Táchira,Córdoba,Capital Córdoba,Vialidad,Sistemas de Vías de Acceso (calles y avenidas),1816000,rehabilitación de vialidad (bacheo asfalto caliente) en  el sector  casco central calle  3 hasta la  calle 16 de santa ana municipio córdoba estado tachira,"reparación de de carpetas de asfalto en la carpeta subyacente deteriorada con asfalto caliente, colocada con mano de obra calificada, empleando maquinaria casco central de la calle 3 hasta la calle 16 entre carreras  0 y 9",Culminado,"18","18","800069","845594",Rehabilitación o Mejora,2023/06/09,26.95,67384.0445269017,1200,m2,Si,asfalto caliente toneladas,"300",bacheo,Elementos no asfalticos,,224.613481756339,no,-72.2704788898554,7.64800672812768,./0.png
-72.1825944336393,7.86961337244704,"29",PI-2023-C-11-E-357-00039745,"2023",C11,GOBERNACIÓN DE TÁCHIRA,Los Andes,Táchira,Andrés Bello,Capital Andrés Bello,Vialidad,Sistemas de Vías de Acceso (calles y avenidas),2528383.12,"i etapa, rehabilitación integral de carpeta asfaltica en frio en el sector monte carmelo, parroquia capital, municipio andrés bello, estado tachira.","el proyecto consiste en la rehabilitación de 10.500 m2 de la carpeta de rodamiento colocando una capa asfaltica de espesor variable,  aproximadamente 1270 toneladas de asfalto frio  beneficiando una población de 3000 habitantes.",Culminado,"18","18","810890","870551",Rehabilitación o Mejora,2023/06/27,27.65,91442.4274864376,10500,m2,Si,asfalto frio (toneladas),"1270",heterogeneo_asf,Elementos no asfalticos,,,no,-72.1825944336393,7.86961337244704,./0.png
-72.2401203859948,7.82073465847349,"30",PI-2023-C-12-E-68-00039932,"2023",C12,ALCALDÍA DE CÁRDENAS (EDO. TÁCHIRA),Los Andes,Táchira,Cárdenas,Cárdenas,Vialidad,Sistemas de Vías de Acceso (calles y avenidas),560400,"rehabilitacion a traves de bacheo de la calle principal del sector las margaritas desde el paseo los artistas hasta los maizales, municipio cardenas, estado tachira","comprende la colocacion de aproximadamente 200 toneladas de asfalto caliente con rc2 y maquinaria especializada, en forma de bacheo sectorizado, y a traves los 10500m2 de la vialidad principal de esta comunidad de las margaritas",Culminado,"18","18","805705","864780",Rehabilitación o Mejora,2023/07/19,28.81,19451.5793127386,10500,m2,Si,mezcla asfaltica en caliente,"180",bacheo,Elementos no asfalticos,,108.064329515215,no,-72.2401203859948,7.82073465847349,./0.png
-72.1916970645672,7.65746660425564,"31",PI-2023-C-2-E-357-00038770,"2023",C2,GOBERNACIÓN DE TÁCHIRA,Los Andes,Táchira,Torbes,Capital Torbes,Vialidad,Sistemas de Vías de Acceso (calles y avenidas),3788225.06,"rehabilitación de la vía que conduce a la población del palmar de la cope, municipio torbes, parroquia capital, estado tachira.","el proyecto consiste en la rehabilitación de 1500 m2, sustitución de 2 alcantarillas, construcción de cunetas, construcción de un sumidero,reparación de una falla de borde y colocación de mezcla asfaltica en caliente en la vía que conduce al palmar de la",Culminado,"18","18","809552","846931",Rehabilitación o Mejora,2023/02/17,24.34,155637.841413311,1500,m2,Si,mezcla asfaltica en caliente ton,"200",heterogeneo_asf,Por descripción,,,no,-72.1916970645672,7.65746660425564,./0.png
-72.3181960707874,10.3346342255679,"32",PI-2023-C-5-E-249-00039098,"2023",C5,ALCALDÍA DE ROSARIO DE PERIJÁ (EDO. ZULIA),Occidental,Zulia,Rosario De Perijá,El Rosario,Vialidad,Sistemas de Vías de Acceso (calles y avenidas),1557807.79,"reasfaltado de la vía principal del sector san andrés (calle 19), tramo comprendido entre la av. 25 (dabajuro) y av. 4, del sector san andrés, villa del rosario, parroquia el rosario, municipio rosario de perija, estado zulia.","actualmente la vía principal (calle 19), del sector san andrés, presenta un deterioro general de la capa asfaltico, debido a ondulaciones , baches, deterioro general con piel de cocodrilo, grietas abundantes y desgastes del pavimento, por lo cual se prop",Culminado,"18","18","793710","1143003",Rehabilitación o Mejora,2023/03/21,24.18,64425.4669148056,4320,m2,Si,mezcla asfaltica (ton),"596",carpeta,Elementos no asfalticos,,108.096420997996,no,-72.3181960707874,10.3346342255679,./0.png
